{
  "conversation_id": "123e4567-e89b-12d3-a456-426614174000",
  "user_id": "123e4567-e89b-12d3-a456-426614174001",
  "conversation_history": [
    {
      "timestamp": "2025-09-02T12:00:00Z",
      "sender": "user",
      "message": "Hello!"
    }
  ],
  "last_message": "Hello!",
  "query": "What is the weather?",
  "task_prompt": null,
  "timestamp": "2025-09-02T12:00:01Z"
}
